{"capabilities":[{"check_id":"check:4dcd27acbbc0db4ef05ccb306cdf6fcf0869ce80985272fa1db7b64aacd51ebf","dimension":"EXECUTION","evidence_refs":["evidence:c75a5c59126e0bbaec3b7c2089d608f85306e767308025bb35bcbb78380b1783"],"id":"capability:aa32d3313c620fa49730891d087b9828b2d75012706f2380f65c9547a08d4ad5","limitations":["Bounded generic intent only; no complete functional coverage or remote policy inference."],"scope":{"kind":"REPOSITORY","subject":"snapshot-2e4e53e771871a4d407ea584b0a7d9b96872e437f91d7356511a88f0903f44cc"},"status":"UNKNOWN"},{"check_id":"check:4dcd27acbbc0db4ef05ccb306cdf6fcf0869ce80985272fa1db7b64aacd51ebf","dimension":"ENFORCEMENT","evidence_refs":["evidence:c75a5c59126e0bbaec3b7c2089d608f85306e767308025bb35bcbb78380b1783"],"id":"capability:b096d8052da0e7375b6735388cfd4ef95f9d79ecf80c32f070525732058b3ede","limitations":["Bounded generic intent only; no complete functional coverage or remote policy inference."],"scope":{"kind":"REPOSITORY","subject":"snapshot-2e4e53e771871a4d407ea584b0a7d9b96872e437f91d7356511a88f0903f44cc"},"status":"UNKNOWN"},{"check_id":"check:4dcd27acbbc0db4ef05ccb306cdf6fcf0869ce80985272fa1db7b64aacd51ebf","dimension":"EFFICACY","evidence_refs":["evidence:c75a5c59126e0bbaec3b7c2089d608f85306e767308025bb35bcbb78380b1783"],"id":"capability:d665cfb22f85b8e0ebc3c1546f1324ce1ef241aaa9c98c8eab1b1850a7a04aec","limitations":["Bounded generic intent only; no complete functional coverage or remote policy inference."],"scope":{"kind":"REPOSITORY","subject":"snapshot-2e4e53e771871a4d407ea584b0a7d9b96872e437f91d7356511a88f0903f44cc"},"status":"UNKNOWN"},{"check_id":"check:4dcd27acbbc0db4ef05ccb306cdf6fcf0869ce80985272fa1db7b64aacd51ebf","dimension":"CONFIGURATION","evidence_refs":["evidence:e6007989875f2760c61e00f3394543becc60c942b208871d3fefa2f4a163501c"],"id":"capability:e80dfd6f726c6f87d94252f9c68d7c6a4373f0382931f3f4852739fcae844827","limitations":["Bounded generic intent only; no complete functional coverage or remote policy inference."],"scope":{"kind":"STEP","subject":"step:a81be5dc07b4ca3eba02abfe34ff8e4e9e7d10bfb61a3769c88f00a71745fa06"},"status":"PRESENT"}],"diagnostics":[],"evidence":[{"cause":null,"check_id":"check:4dcd27acbbc0db4ef05ccb306cdf6fcf0869ce80985272fa1db7b64aacd51ebf","execution":null,"id":"evidence:188f11daf743c444f41e20220ae6eaff344d2d4f7faaa6c62d4957e8216ab04d","limitations":["Static configuration only; historical execution and remote enforcement remain UNKNOWN."],"provenance":{"adapter":"audit-v1","basis":"SOURCE","kind":"CONFIGURATION","sources":[{"column":2,"line":1,"path":".ci-trust.json"},{"column":14,"line":1,"path":".ci-trust.json"}]},"scope":{"kind":"REPOSITORY","subject":"snapshot-2e4e53e771871a4d407ea584b0a7d9b96872e437f91d7356511a88f0903f44cc"},"state":"CONFIGURED"},{"cause":null,"check_id":"check:4dcd27acbbc0db4ef05ccb306cdf6fcf0869ce80985272fa1db7b64aacd51ebf","execution":null,"id":"evidence:7c236be97fd7301fe36b050561172508b14a55deff3908395799d8370ec8c337","limitations":["Static configuration only; historical execution and remote enforcement remain UNKNOWN."],"provenance":{"adapter":"audit-v1","basis":"SOURCE","kind":"CONFIGURATION","sources":[{"column":3,"line":3,"path":".github/workflows/ci.yml"},{"column":14,"line":7,"path":".github/workflows/ci.yml"},{"column":9,"line":6,"path":".github/workflows/ci.yml"},{"column":14,"line":6,"path":".github/workflows/ci.yml"},{"column":14,"line":9,"path":".github/workflows/ci.yml"}]},"scope":{"kind":"REPOSITORY","subject":"snapshot-2e4e53e771871a4d407ea584b0a7d9b96872e437f91d7356511a88f0903f44cc"},"state":"CONFIGURED"},{"cause":null,"check_id":"check:4dcd27acbbc0db4ef05ccb306cdf6fcf0869ce80985272fa1db7b64aacd51ebf","execution":null,"id":"evidence:894113871acdfe06cc3fb925df97d9edda7a61a52546cd53a4ab62cf5f00eeb3","limitations":["Static configuration only; historical execution and remote enforcement remain UNKNOWN."],"provenance":{"adapter":"audit-v1","basis":"SOURCE","kind":"CONFIGURATION","sources":[{"column":3,"line":3,"path":".github/workflows/ci.yml"},{"column":14,"line":7,"path":".github/workflows/ci.yml"},{"column":9,"line":6,"path":".github/workflows/ci.yml"}]},"scope":{"kind":"JOB","subject":"job:6d5e32ac1d22ee321ff54124493143e7171272d6ea9a1c91792fea6f8f1b36ba"},"state":"CONFIGURED"},{"cause":null,"check_id":"check:4dcd27acbbc0db4ef05ccb306cdf6fcf0869ce80985272fa1db7b64aacd51ebf","execution":null,"id":"evidence:b3e3561d3673ed27de6734a9a2d6c4d2ed89a03d4d2ac2d95cae856ad490943f","limitations":["Static configuration only; historical execution and remote enforcement remain UNKNOWN."],"provenance":{"adapter":"audit-v1","basis":"SOURCE","kind":"CONFIGURATION","sources":[{"column":9,"line":9,"path":".github/workflows/ci.yml"},{"column":14,"line":9,"path":".github/workflows/ci.yml"}]},"scope":{"kind":"STEP","subject":"step:a81be5dc07b4ca3eba02abfe34ff8e4e9e7d10bfb61a3769c88f00a71745fa06"},"state":"CONFIGURED"},{"cause":null,"check_id":"check:4dcd27acbbc0db4ef05ccb306cdf6fcf0869ce80985272fa1db7b64aacd51ebf","execution":null,"id":"evidence:c75a5c59126e0bbaec3b7c2089d608f85306e767308025bb35bcbb78380b1783","limitations":["Static configuration only; historical execution and remote enforcement remain UNKNOWN."],"provenance":{"adapter":"audit-v1","basis":"UNRESOLVED","kind":"DIAGNOSTIC","sources":[]},"scope":{"kind":"REPOSITORY","subject":"snapshot-2e4e53e771871a4d407ea584b0a7d9b96872e437f91d7356511a88f0903f44cc"},"state":"UNKNOWN"},{"cause":null,"check_id":"check:4dcd27acbbc0db4ef05ccb306cdf6fcf0869ce80985272fa1db7b64aacd51ebf","execution":null,"id":"evidence:e6007989875f2760c61e00f3394543becc60c942b208871d3fefa2f4a163501c","limitations":["Static configuration only; historical execution and remote enforcement remain UNKNOWN."],"provenance":{"adapter":"audit-v1","basis":"SOURCE","kind":"CONFIGURATION","sources":[{"column":9,"line":9,"path":".github/workflows/ci.yml"},{"column":14,"line":9,"path":".github/workflows/ci.yml"}]},"scope":{"kind":"STEP","subject":"step:a81be5dc07b4ca3eba02abfe34ff8e4e9e7d10bfb61a3769c88f00a71745fa06"},"state":"CONFIGURED"}],"findings":[{"certainty":"UNKNOWN","certainty_rule":"Bounded offline literal configuration analysis; no run or remote policy evidence.","evidence_refs":["evidence:c75a5c59126e0bbaec3b7c2089d608f85306e767308025bb35bcbb78380b1783"],"explanation":"Required checks and actual enforcement remain UNKNOWN offline.","id":"finding:3353e00d7fdc1ce2cca4ff585c4f8b407826914c6b0405adf1a0b3d649eabf8f","limitations":["No historical execution, global non-execution, or enforcement claim.","No remote policy collection is performed."],"rule_id":"CIT_REQUIRED_CHECKS_UNKNOWN","scope":{"kind":"REPOSITORY","subject":"snapshot-2e4e53e771871a4d407ea584b0a7d9b96872e437f91d7356511a88f0903f44cc"}},{"certainty":"DERIVED","certainty_rule":"Bounded offline literal configuration analysis; no run or remote policy evidence.","evidence_refs":["evidence:188f11daf743c444f41e20220ae6eaff344d2d4f7faaa6c62d4957e8216ab04d","evidence:7c236be97fd7301fe36b050561172508b14a55deff3908395799d8370ec8c337"],"explanation":"Declared windows lacks a configured generic TEST runner path within supplied literal workflows/events: push.","id":"finding:5dcdbfb4fe28476c4c6207b7da5272e8497edce9298390c02817e391c17102ce","limitations":["No historical execution, global non-execution, or enforcement claim.","Closed supplied configuration scope only; not OS correctness or global execution absence. No ABSENT capability is asserted."],"rule_id":"CIT_PLATFORM_CONFIGURED_GAP","scope":{"kind":"REPOSITORY","subject":"snapshot-2e4e53e771871a4d407ea584b0a7d9b96872e437f91d7356511a88f0903f44cc"}},{"certainty":"DERIVED","certainty_rule":"Bounded offline literal configuration analysis; no run or remote policy evidence.","evidence_refs":["evidence:188f11daf743c444f41e20220ae6eaff344d2d4f7faaa6c62d4957e8216ab04d","evidence:7c236be97fd7301fe36b050561172508b14a55deff3908395799d8370ec8c337"],"explanation":"Declared macos lacks a configured generic TEST runner path within supplied literal workflows/events: push.","id":"finding:cfd983ea7022a84b79db756f7a2c00f09cf45d6d97ab790a11e7d1b8b113ff0b","limitations":["No historical execution, global non-execution, or enforcement claim.","Closed supplied configuration scope only; not OS correctness or global execution absence. No ABSENT capability is asserted."],"rule_id":"CIT_PLATFORM_CONFIGURED_GAP","scope":{"kind":"REPOSITORY","subject":"snapshot-2e4e53e771871a4d407ea584b0a7d9b96872e437f91d7356511a88f0903f44cc"}}],"inventory":[{"evidence_refs":[],"id":"check:4dcd27acbbc0db4ef05ccb306cdf6fcf0869ce80985272fa1db7b64aacd51ebf","kind":"CHECK","name":"Bounded offline validation configuration","source":{"column":1,"line":1,"path":".github/workflows/ci.yml"}}],"limitations":["Offline bounded configuration only. Historical execution, efficacy and required-check enforcement are UNKNOWN. Runner OS is not a cross-compilation target. Generic TEST intent is not unit, integration or E2E completeness.","Configured TEST intent only within a source-backed step; no inferred category completeness."],"schema_version":"1","snapshot":{"commit_sha":null,"id":"snapshot-2e4e53e771871a4d407ea584b0a7d9b96872e437f91d7356511a88f0903f44cc","repository_id":null},"workflows":[{"events":["push"],"id":"workflow:5d60c92b61b5a86654ab4d38782d62852528a098de97c477826007c94da09f2b","jobs":[{"evidence_refs":["evidence:894113871acdfe06cc3fb925df97d9edda7a61a52546cd53a4ab62cf5f00eeb3"],"id":"job:6d5e32ac1d22ee321ff54124493143e7171272d6ea9a1c91792fea6f8f1b36ba","needs":[]}],"source":{"column":1,"line":1,"path":".github/workflows/ci.yml"}}]}
