{"capabilities":[{"check_id":"check:2df316586065582d5332b572cde20966d0122d349b638761de4551ad06c092ef","dimension":"CONFIGURATION","evidence_refs":["evidence:f34ae7db6ff4f59fc2416f07242b3fb5d8917dc08c523e6069dcbd18c21f4e53"],"id":"capability:27fa8d42c4ca8fdfb5774a149079be9128e3a61eeb4c60d9281c9642d7420df6","limitations":["Bounded generic intent only; no complete functional coverage or remote policy inference."],"scope":{"kind":"STEP","subject":"step:decd023b292bf7b857ed10661e0c5c8cf373f0be34b3b3eccfc9ba5774e554b6"},"status":"PRESENT"},{"check_id":"check:2df316586065582d5332b572cde20966d0122d349b638761de4551ad06c092ef","dimension":"EXECUTION","evidence_refs":["evidence:c75a5c59126e0bbaec3b7c2089d608f85306e767308025bb35bcbb78380b1783"],"id":"capability:aa32d3313c620fa49730891d087b9828b2d75012706f2380f65c9547a08d4ad5","limitations":["Bounded generic intent only; no complete functional coverage or remote policy inference."],"scope":{"kind":"REPOSITORY","subject":"snapshot-bd792c7d9a1b54b76469a1271c6cb7d3a12d34bc0606996126ba8f246d375a7b"},"status":"UNKNOWN"},{"check_id":"check:2df316586065582d5332b572cde20966d0122d349b638761de4551ad06c092ef","dimension":"ENFORCEMENT","evidence_refs":["evidence:c75a5c59126e0bbaec3b7c2089d608f85306e767308025bb35bcbb78380b1783"],"id":"capability:b096d8052da0e7375b6735388cfd4ef95f9d79ecf80c32f070525732058b3ede","limitations":["Bounded generic intent only; no complete functional coverage or remote policy inference."],"scope":{"kind":"REPOSITORY","subject":"snapshot-bd792c7d9a1b54b76469a1271c6cb7d3a12d34bc0606996126ba8f246d375a7b"},"status":"UNKNOWN"},{"check_id":"check:2df316586065582d5332b572cde20966d0122d349b638761de4551ad06c092ef","dimension":"EFFICACY","evidence_refs":["evidence:c75a5c59126e0bbaec3b7c2089d608f85306e767308025bb35bcbb78380b1783"],"id":"capability:d665cfb22f85b8e0ebc3c1546f1324ce1ef241aaa9c98c8eab1b1850a7a04aec","limitations":["Bounded generic intent only; no complete functional coverage or remote policy inference."],"scope":{"kind":"REPOSITORY","subject":"snapshot-bd792c7d9a1b54b76469a1271c6cb7d3a12d34bc0606996126ba8f246d375a7b"},"status":"UNKNOWN"}],"diagnostics":[{"code":"DECLARATION_UNKNOWN","id":"diagnostic:bba087566749ded07fe723f772da10bfe18941528ae5b3e817c1dcf6c88ef9c8","message":"Static analysis could not resolve this input; no execution or enforcement is inferred.","source":null}],"evidence":[{"cause":null,"check_id":"check:2df316586065582d5332b572cde20966d0122d349b638761de4551ad06c092ef","execution":null,"id":"evidence:188f11daf743c444f41e20220ae6eaff344d2d4f7faaa6c62d4957e8216ab04d","limitations":["Static configuration only; historical execution and remote enforcement remain UNKNOWN."],"provenance":{"adapter":"audit-v1","basis":"UNRESOLVED","kind":"DIAGNOSTIC","sources":[]},"scope":{"kind":"REPOSITORY","subject":"snapshot-bd792c7d9a1b54b76469a1271c6cb7d3a12d34bc0606996126ba8f246d375a7b"},"state":"UNKNOWN"},{"cause":null,"check_id":"check:2df316586065582d5332b572cde20966d0122d349b638761de4551ad06c092ef","execution":null,"id":"evidence:894113871acdfe06cc3fb925df97d9edda7a61a52546cd53a4ab62cf5f00eeb3","limitations":["Static configuration only; historical execution and remote enforcement remain UNKNOWN."],"provenance":{"adapter":"audit-v1","basis":"SOURCE","kind":"CONFIGURATION","sources":[{"column":3,"line":3,"path":".github/workflows/ci.yml"},{"column":14,"line":5,"path":".github/workflows/ci.yml"},{"column":9,"line":4,"path":".github/workflows/ci.yml"}]},"scope":{"kind":"JOB","subject":"job:6d5e32ac1d22ee321ff54124493143e7171272d6ea9a1c91792fea6f8f1b36ba"},"state":"CONFIGURED"},{"cause":null,"check_id":"check:2df316586065582d5332b572cde20966d0122d349b638761de4551ad06c092ef","execution":null,"id":"evidence:9f75611ea62d98e418c32049b8bc74aaf28c0c36a024e65a70e8488dc2cf6d50","limitations":["Static configuration only; historical execution and remote enforcement remain UNKNOWN."],"provenance":{"adapter":"audit-v1","basis":"SOURCE","kind":"CONFIGURATION","sources":[{"column":9,"line":7,"path":".github/workflows/ci.yml"},{"column":14,"line":7,"path":".github/workflows/ci.yml"}]},"scope":{"kind":"STEP","subject":"step:decd023b292bf7b857ed10661e0c5c8cf373f0be34b3b3eccfc9ba5774e554b6"},"state":"CONFIGURED"},{"cause":null,"check_id":"check:2df316586065582d5332b572cde20966d0122d349b638761de4551ad06c092ef","execution":null,"id":"evidence:c75a5c59126e0bbaec3b7c2089d608f85306e767308025bb35bcbb78380b1783","limitations":["Static configuration only; historical execution and remote enforcement remain UNKNOWN."],"provenance":{"adapter":"audit-v1","basis":"UNRESOLVED","kind":"DIAGNOSTIC","sources":[]},"scope":{"kind":"REPOSITORY","subject":"snapshot-bd792c7d9a1b54b76469a1271c6cb7d3a12d34bc0606996126ba8f246d375a7b"},"state":"UNKNOWN"},{"cause":null,"check_id":"check:2df316586065582d5332b572cde20966d0122d349b638761de4551ad06c092ef","execution":null,"id":"evidence:f34ae7db6ff4f59fc2416f07242b3fb5d8917dc08c523e6069dcbd18c21f4e53","limitations":["Static configuration only; historical execution and remote enforcement remain UNKNOWN."],"provenance":{"adapter":"audit-v1","basis":"SOURCE","kind":"CONFIGURATION","sources":[{"column":9,"line":7,"path":".github/workflows/ci.yml"},{"column":14,"line":7,"path":".github/workflows/ci.yml"}]},"scope":{"kind":"STEP","subject":"step:decd023b292bf7b857ed10661e0c5c8cf373f0be34b3b3eccfc9ba5774e554b6"},"state":"CONFIGURED"}],"findings":[{"certainty":"UNKNOWN","certainty_rule":"Bounded offline literal configuration analysis; no run or remote policy evidence.","evidence_refs":["evidence:188f11daf743c444f41e20220ae6eaff344d2d4f7faaa6c62d4957e8216ab04d"],"explanation":"Platform declaration absent or unsupported; support scope remains UNKNOWN.","id":"finding:2d9a767724215087062e777eb6ae592c357602caa7f8ab8e3ae2e6fa2c946add","limitations":["No historical execution, global non-execution, or enforcement claim.","README prose and names are not authoritative platform declarations."],"rule_id":"CIT_DECLARATION_UNKNOWN","scope":{"kind":"REPOSITORY","subject":"snapshot-bd792c7d9a1b54b76469a1271c6cb7d3a12d34bc0606996126ba8f246d375a7b"}},{"certainty":"UNKNOWN","certainty_rule":"Bounded offline literal configuration analysis; no run or remote policy evidence.","evidence_refs":["evidence:c75a5c59126e0bbaec3b7c2089d608f85306e767308025bb35bcbb78380b1783"],"explanation":"Required checks and actual enforcement remain UNKNOWN offline.","id":"finding:3353e00d7fdc1ce2cca4ff585c4f8b407826914c6b0405adf1a0b3d649eabf8f","limitations":["No historical execution, global non-execution, or enforcement claim.","No remote policy collection is performed."],"rule_id":"CIT_REQUIRED_CHECKS_UNKNOWN","scope":{"kind":"REPOSITORY","subject":"snapshot-bd792c7d9a1b54b76469a1271c6cb7d3a12d34bc0606996126ba8f246d375a7b"}},{"certainty":"DIRECT","certainty_rule":"Bounded offline literal configuration analysis; no run or remote policy evidence.","evidence_refs":["evidence:894113871acdfe06cc3fb925df97d9edda7a61a52546cd53a4ab62cf5f00eeb3"],"explanation":"Known static exclusion for event pull_request; not an observed historical skip.","id":"finding:8e5390d987c74cc5dd6b99b99830f58a02cad0cbe16b79922319e5f4f6024ce7","limitations":["No historical execution, global non-execution, or enforcement claim.","Static event eligibility only."],"rule_id":"CIT_STATIC_OMISSION","scope":{"kind":"JOB","subject":"job:6d5e32ac1d22ee321ff54124493143e7171272d6ea9a1c91792fea6f8f1b36ba"}},{"certainty":"DIRECT","certainty_rule":"Bounded offline literal configuration analysis; no run or remote policy evidence.","evidence_refs":["evidence:894113871acdfe06cc3fb925df97d9edda7a61a52546cd53a4ab62cf5f00eeb3","evidence:9f75611ea62d98e418c32049b8bc74aaf28c0c36a024e65a70e8488dc2cf6d50"],"explanation":"Known static exclusion for event pull_request; not an observed historical skip.","id":"finding:ca637aacdb41b146707e30430eceafe3b0bff51f77d688aaf3184bdca0d6d1cf","limitations":["No historical execution, global non-execution, or enforcement claim.","Static event eligibility only."],"rule_id":"CIT_STATIC_OMISSION","scope":{"kind":"STEP","subject":"step:decd023b292bf7b857ed10661e0c5c8cf373f0be34b3b3eccfc9ba5774e554b6"}}],"inventory":[{"evidence_refs":[],"id":"check:2df316586065582d5332b572cde20966d0122d349b638761de4551ad06c092ef","kind":"CHECK","name":"Bounded offline validation configuration","source":{"column":1,"line":1,"path":".github/workflows/ci.yml"}}],"limitations":["Offline bounded configuration only. Historical execution, efficacy and required-check enforcement are UNKNOWN. Runner OS is not a cross-compilation target. Generic TEST intent is not unit, integration or E2E completeness.","Configured TEST intent only within a source-backed step; no inferred category completeness."],"schema_version":"1","snapshot":{"commit_sha":null,"id":"snapshot-bd792c7d9a1b54b76469a1271c6cb7d3a12d34bc0606996126ba8f246d375a7b","repository_id":null},"workflows":[{"events":["pull_request","push"],"id":"workflow:5d60c92b61b5a86654ab4d38782d62852528a098de97c477826007c94da09f2b","jobs":[{"evidence_refs":["evidence:894113871acdfe06cc3fb925df97d9edda7a61a52546cd53a4ab62cf5f00eeb3"],"id":"job:6d5e32ac1d22ee321ff54124493143e7171272d6ea9a1c91792fea6f8f1b36ba","needs":[]}],"source":{"column":1,"line":1,"path":".github/workflows/ci.yml"}}]}
