{"capabilities":[{"check_id":"check:dfcd7f02d5b495dc301f6dbc00df04ec34b87c9e3d91a0707f20d0f757b42ecd","dimension":"EXECUTION","evidence_refs":["evidence:c75a5c59126e0bbaec3b7c2089d608f85306e767308025bb35bcbb78380b1783"],"id":"capability:aa32d3313c620fa49730891d087b9828b2d75012706f2380f65c9547a08d4ad5","limitations":["Bounded generic intent only; no complete functional coverage or remote policy inference."],"scope":{"kind":"REPOSITORY","subject":"snapshot-6d58c5fc00e2c749074111273f1141c6f6291fb6119152a37a23ea53a1cef03c"},"status":"UNKNOWN"},{"check_id":"check:dfcd7f02d5b495dc301f6dbc00df04ec34b87c9e3d91a0707f20d0f757b42ecd","dimension":"ENFORCEMENT","evidence_refs":["evidence:c75a5c59126e0bbaec3b7c2089d608f85306e767308025bb35bcbb78380b1783"],"id":"capability:b096d8052da0e7375b6735388cfd4ef95f9d79ecf80c32f070525732058b3ede","limitations":["Bounded generic intent only; no complete functional coverage or remote policy inference."],"scope":{"kind":"REPOSITORY","subject":"snapshot-6d58c5fc00e2c749074111273f1141c6f6291fb6119152a37a23ea53a1cef03c"},"status":"UNKNOWN"},{"check_id":"check:dfcd7f02d5b495dc301f6dbc00df04ec34b87c9e3d91a0707f20d0f757b42ecd","dimension":"EFFICACY","evidence_refs":["evidence:c75a5c59126e0bbaec3b7c2089d608f85306e767308025bb35bcbb78380b1783"],"id":"capability:d665cfb22f85b8e0ebc3c1546f1324ce1ef241aaa9c98c8eab1b1850a7a04aec","limitations":["Bounded generic intent only; no complete functional coverage or remote policy inference."],"scope":{"kind":"REPOSITORY","subject":"snapshot-6d58c5fc00e2c749074111273f1141c6f6291fb6119152a37a23ea53a1cef03c"},"status":"UNKNOWN"},{"check_id":"check:dfcd7f02d5b495dc301f6dbc00df04ec34b87c9e3d91a0707f20d0f757b42ecd","dimension":"CONFIGURATION","evidence_refs":["evidence:5763d05a00c90c7c92ac0763c99d9fcb808689ced327086c40e89dd806189b77"],"id":"capability:f60da865606ffacfbb3419c2cc251ce19953cb10fedba4a1dda3bf703b9ccf4b","limitations":["Bounded generic intent only; no complete functional coverage or remote policy inference."],"scope":{"kind":"STEP","subject":"step:e3ce9576436345e2241f72eb2191e7174e5bb179f0b718dc259d85e501c585d4"},"status":"PRESENT"}],"diagnostics":[{"code":"DECLARATION_UNKNOWN","id":"diagnostic:bba087566749ded07fe723f772da10bfe18941528ae5b3e817c1dcf6c88ef9c8","message":"Static analysis could not resolve this input; no execution or enforcement is inferred.","source":null}],"evidence":[{"cause":null,"check_id":"check:dfcd7f02d5b495dc301f6dbc00df04ec34b87c9e3d91a0707f20d0f757b42ecd","execution":null,"id":"evidence:123b7ef49016605f6a48082aec52255ab661da1311049a0dbbad10ee3d8ab87b","limitations":["Static configuration only; historical execution and remote enforcement remain UNKNOWN."],"provenance":{"adapter":"audit-v1","basis":"SOURCE","kind":"CONFIGURATION","sources":[{"column":9,"line":6,"path":".github/workflows/ci.yml"},{"column":14,"line":6,"path":".github/workflows/ci.yml"}]},"scope":{"kind":"STEP","subject":"step:e3ce9576436345e2241f72eb2191e7174e5bb179f0b718dc259d85e501c585d4"},"state":"CONFIGURED"},{"cause":null,"check_id":"check:dfcd7f02d5b495dc301f6dbc00df04ec34b87c9e3d91a0707f20d0f757b42ecd","execution":null,"id":"evidence:188f11daf743c444f41e20220ae6eaff344d2d4f7faaa6c62d4957e8216ab04d","limitations":["Static configuration only; historical execution and remote enforcement remain UNKNOWN."],"provenance":{"adapter":"audit-v1","basis":"UNRESOLVED","kind":"DIAGNOSTIC","sources":[]},"scope":{"kind":"REPOSITORY","subject":"snapshot-6d58c5fc00e2c749074111273f1141c6f6291fb6119152a37a23ea53a1cef03c"},"state":"UNKNOWN"},{"cause":null,"check_id":"check:dfcd7f02d5b495dc301f6dbc00df04ec34b87c9e3d91a0707f20d0f757b42ecd","execution":null,"id":"evidence:54fb08f6f663275fd3ea0912542dbf4bb0370103b03b35be0a30677000e17d72","limitations":["Static configuration only; historical execution and remote enforcement remain UNKNOWN."],"provenance":{"adapter":"audit-v1","basis":"SOURCE","kind":"CONFIGURATION","sources":[{"column":60,"line":1,"path":"package.json"}]},"scope":{"kind":"REPOSITORY","subject":"snapshot-6d58c5fc00e2c749074111273f1141c6f6291fb6119152a37a23ea53a1cef03c"},"state":"CONFIGURED"},{"cause":null,"check_id":"check:dfcd7f02d5b495dc301f6dbc00df04ec34b87c9e3d91a0707f20d0f757b42ecd","execution":null,"id":"evidence:5763d05a00c90c7c92ac0763c99d9fcb808689ced327086c40e89dd806189b77","limitations":["Static configuration only; historical execution and remote enforcement remain UNKNOWN."],"provenance":{"adapter":"audit-v1","basis":"SOURCE","kind":"CONFIGURATION","sources":[{"column":9,"line":6,"path":".github/workflows/ci.yml"},{"column":14,"line":6,"path":".github/workflows/ci.yml"},{"column":78,"line":1,"path":"package.json"}]},"scope":{"kind":"STEP","subject":"step:e3ce9576436345e2241f72eb2191e7174e5bb179f0b718dc259d85e501c585d4"},"state":"CONFIGURED"},{"cause":null,"check_id":"check:dfcd7f02d5b495dc301f6dbc00df04ec34b87c9e3d91a0707f20d0f757b42ecd","execution":null,"id":"evidence:894113871acdfe06cc3fb925df97d9edda7a61a52546cd53a4ab62cf5f00eeb3","limitations":["Static configuration only; historical execution and remote enforcement remain UNKNOWN."],"provenance":{"adapter":"audit-v1","basis":"SOURCE","kind":"CONFIGURATION","sources":[{"column":3,"line":3,"path":".github/workflows/ci.yml"},{"column":14,"line":4,"path":".github/workflows/ci.yml"}]},"scope":{"kind":"JOB","subject":"job:6d5e32ac1d22ee321ff54124493143e7171272d6ea9a1c91792fea6f8f1b36ba"},"state":"CONFIGURED"},{"cause":null,"check_id":"check:dfcd7f02d5b495dc301f6dbc00df04ec34b87c9e3d91a0707f20d0f757b42ecd","execution":null,"id":"evidence:c75a5c59126e0bbaec3b7c2089d608f85306e767308025bb35bcbb78380b1783","limitations":["Static configuration only; historical execution and remote enforcement remain UNKNOWN."],"provenance":{"adapter":"audit-v1","basis":"UNRESOLVED","kind":"DIAGNOSTIC","sources":[]},"scope":{"kind":"REPOSITORY","subject":"snapshot-6d58c5fc00e2c749074111273f1141c6f6291fb6119152a37a23ea53a1cef03c"},"state":"UNKNOWN"}],"findings":[{"certainty":"UNKNOWN","certainty_rule":"Bounded offline literal configuration analysis; no run or remote policy evidence.","evidence_refs":["evidence:188f11daf743c444f41e20220ae6eaff344d2d4f7faaa6c62d4957e8216ab04d"],"explanation":"Platform declaration absent or unsupported; support scope remains UNKNOWN.","id":"finding:2d9a767724215087062e777eb6ae592c357602caa7f8ab8e3ae2e6fa2c946add","limitations":["No historical execution, global non-execution, or enforcement claim.","README prose and names are not authoritative platform declarations."],"rule_id":"CIT_DECLARATION_UNKNOWN","scope":{"kind":"REPOSITORY","subject":"snapshot-6d58c5fc00e2c749074111273f1141c6f6291fb6119152a37a23ea53a1cef03c"}},{"certainty":"UNKNOWN","certainty_rule":"Bounded offline literal configuration analysis; no run or remote policy evidence.","evidence_refs":["evidence:c75a5c59126e0bbaec3b7c2089d608f85306e767308025bb35bcbb78380b1783"],"explanation":"Required checks and actual enforcement remain UNKNOWN offline.","id":"finding:3353e00d7fdc1ce2cca4ff585c4f8b407826914c6b0405adf1a0b3d649eabf8f","limitations":["No historical execution, global non-execution, or enforcement claim.","No remote policy collection is performed."],"rule_id":"CIT_REQUIRED_CHECKS_UNKNOWN","scope":{"kind":"REPOSITORY","subject":"snapshot-6d58c5fc00e2c749074111273f1141c6f6291fb6119152a37a23ea53a1cef03c"}},{"certainty":"DIRECT","certainty_rule":"Bounded offline literal configuration analysis; no run or remote policy evidence.","evidence_refs":["evidence:54fb08f6f663275fd3ea0912542dbf4bb0370103b03b35be0a30677000e17d72"],"explanation":"Available npm definition has no understood workflow link.","id":"finding:efa23e2c8e36248487a1878e757ffcfe7a2220239a2a55af4dd8a748d84b8168","limitations":["No historical execution, global non-execution, or enforcement claim.","Unlinked does not prove never executed elsewhere; unsupported invocations may remain unresolved."],"rule_id":"CIT_COMMAND_UNLINKED","scope":{"kind":"REPOSITORY","subject":"snapshot-6d58c5fc00e2c749074111273f1141c6f6291fb6119152a37a23ea53a1cef03c"}}],"inventory":[{"evidence_refs":[],"id":"check:dfcd7f02d5b495dc301f6dbc00df04ec34b87c9e3d91a0707f20d0f757b42ecd","kind":"CHECK","name":"Bounded offline validation configuration","source":{"column":1,"line":1,"path":".github/workflows/ci.yml"}}],"limitations":["Offline bounded configuration only. Historical execution, efficacy and required-check enforcement are UNKNOWN. Runner OS is not a cross-compilation target. Generic TEST intent is not unit, integration or E2E completeness.","Configured TEST intent only within a source-backed step; no inferred category completeness."],"schema_version":"1","snapshot":{"commit_sha":null,"id":"snapshot-6d58c5fc00e2c749074111273f1141c6f6291fb6119152a37a23ea53a1cef03c","repository_id":null},"workflows":[{"events":["push"],"id":"workflow:5d60c92b61b5a86654ab4d38782d62852528a098de97c477826007c94da09f2b","jobs":[{"evidence_refs":["evidence:894113871acdfe06cc3fb925df97d9edda7a61a52546cd53a4ab62cf5f00eeb3"],"id":"job:6d5e32ac1d22ee321ff54124493143e7171272d6ea9a1c91792fea6f8f1b36ba","needs":[]}],"source":{"column":1,"line":1,"path":".github/workflows/ci.yml"}}]}
