{"capabilities":[{"check_id":"check:638bedb6e1e53eef2c4387a162664c6774c4922b74dd454f0d3609581e1a5fd3","dimension":"EXECUTION","evidence_refs":["evidence:c75a5c59126e0bbaec3b7c2089d608f85306e767308025bb35bcbb78380b1783"],"id":"capability:aa32d3313c620fa49730891d087b9828b2d75012706f2380f65c9547a08d4ad5","limitations":["Bounded generic intent only; no complete functional coverage or remote policy inference."],"scope":{"kind":"REPOSITORY","subject":"snapshot-1ec9211d44ad3de6ba87a089201b2b54a03cac3500419fff0ada15ae45d573c4"},"status":"UNKNOWN"},{"check_id":"check:638bedb6e1e53eef2c4387a162664c6774c4922b74dd454f0d3609581e1a5fd3","dimension":"ENFORCEMENT","evidence_refs":["evidence:c75a5c59126e0bbaec3b7c2089d608f85306e767308025bb35bcbb78380b1783"],"id":"capability:b096d8052da0e7375b6735388cfd4ef95f9d79ecf80c32f070525732058b3ede","limitations":["Bounded generic intent only; no complete functional coverage or remote policy inference."],"scope":{"kind":"REPOSITORY","subject":"snapshot-1ec9211d44ad3de6ba87a089201b2b54a03cac3500419fff0ada15ae45d573c4"},"status":"UNKNOWN"},{"check_id":"check:638bedb6e1e53eef2c4387a162664c6774c4922b74dd454f0d3609581e1a5fd3","dimension":"EFFICACY","evidence_refs":["evidence:c75a5c59126e0bbaec3b7c2089d608f85306e767308025bb35bcbb78380b1783"],"id":"capability:d665cfb22f85b8e0ebc3c1546f1324ce1ef241aaa9c98c8eab1b1850a7a04aec","limitations":["Bounded generic intent only; no complete functional coverage or remote policy inference."],"scope":{"kind":"REPOSITORY","subject":"snapshot-1ec9211d44ad3de6ba87a089201b2b54a03cac3500419fff0ada15ae45d573c4"},"status":"UNKNOWN"}],"diagnostics":[{"code":"DECLARATION_UNKNOWN","id":"diagnostic:bba087566749ded07fe723f772da10bfe18941528ae5b3e817c1dcf6c88ef9c8","message":"Static analysis could not resolve this input; no execution or enforcement is inferred.","source":null}],"evidence":[{"cause":null,"check_id":"check:638bedb6e1e53eef2c4387a162664c6774c4922b74dd454f0d3609581e1a5fd3","execution":null,"id":"evidence:188f11daf743c444f41e20220ae6eaff344d2d4f7faaa6c62d4957e8216ab04d","limitations":["Static configuration only; historical execution and remote enforcement remain UNKNOWN."],"provenance":{"adapter":"audit-v1","basis":"UNRESOLVED","kind":"DIAGNOSTIC","sources":[]},"scope":{"kind":"REPOSITORY","subject":"snapshot-1ec9211d44ad3de6ba87a089201b2b54a03cac3500419fff0ada15ae45d573c4"},"state":"UNKNOWN"},{"cause":null,"check_id":"check:638bedb6e1e53eef2c4387a162664c6774c4922b74dd454f0d3609581e1a5fd3","execution":null,"id":"evidence:4e633eb62db939e8d451d3cd398ad9440e2e21f7a002888e6086b02ab53fdec9","limitations":["Static configuration only; historical execution and remote enforcement remain UNKNOWN."],"provenance":{"adapter":"audit-v1","basis":"SOURCE","kind":"CONFIGURATION","sources":[{"column":3,"line":3,"path":".github/workflows/ci.yml"},{"column":14,"line":5,"path":".github/workflows/ci.yml"}]},"scope":{"kind":"JOB","subject":"job:786f8b6a9e3d63dc4314cbd0f883e13e9b4616465935f7fda7be9db8a84ff479"},"state":"CONFIGURED"},{"cause":null,"check_id":"check:638bedb6e1e53eef2c4387a162664c6774c4922b74dd454f0d3609581e1a5fd3","execution":null,"id":"evidence:77d5e9a3f37b99b3dbbba7c4ca5283734dfa318adc1bb4337f2c3672e74932c5","limitations":["Static configuration only; historical execution and remote enforcement remain UNKNOWN."],"provenance":{"adapter":"audit-v1","basis":"SOURCE","kind":"CONFIGURATION","sources":[{"column":9,"line":7,"path":".github/workflows/ci.yml"},{"column":14,"line":7,"path":".github/workflows/ci.yml"}]},"scope":{"kind":"STEP","subject":"step:6f20e3b530173b94f55a2cbd8a32682a682ac24d44d5cd787b0dfb4f7dd8e916"},"state":"CONFIGURED"},{"cause":null,"check_id":"check:638bedb6e1e53eef2c4387a162664c6774c4922b74dd454f0d3609581e1a5fd3","execution":null,"id":"evidence:c75a5c59126e0bbaec3b7c2089d608f85306e767308025bb35bcbb78380b1783","limitations":["Static configuration only; historical execution and remote enforcement remain UNKNOWN."],"provenance":{"adapter":"audit-v1","basis":"UNRESOLVED","kind":"DIAGNOSTIC","sources":[]},"scope":{"kind":"REPOSITORY","subject":"snapshot-1ec9211d44ad3de6ba87a089201b2b54a03cac3500419fff0ada15ae45d573c4"},"state":"UNKNOWN"}],"findings":[{"certainty":"UNKNOWN","certainty_rule":"Bounded offline literal configuration analysis; no run or remote policy evidence.","evidence_refs":["evidence:188f11daf743c444f41e20220ae6eaff344d2d4f7faaa6c62d4957e8216ab04d"],"explanation":"Platform declaration absent or unsupported; support scope remains UNKNOWN.","id":"finding:2d9a767724215087062e777eb6ae592c357602caa7f8ab8e3ae2e6fa2c946add","limitations":["No historical execution, global non-execution, or enforcement claim.","README prose and names are not authoritative platform declarations."],"rule_id":"CIT_DECLARATION_UNKNOWN","scope":{"kind":"REPOSITORY","subject":"snapshot-1ec9211d44ad3de6ba87a089201b2b54a03cac3500419fff0ada15ae45d573c4"}},{"certainty":"UNKNOWN","certainty_rule":"Bounded offline literal configuration analysis; no run or remote policy evidence.","evidence_refs":["evidence:c75a5c59126e0bbaec3b7c2089d608f85306e767308025bb35bcbb78380b1783"],"explanation":"Required checks and actual enforcement remain UNKNOWN offline.","id":"finding:3353e00d7fdc1ce2cca4ff585c4f8b407826914c6b0405adf1a0b3d649eabf8f","limitations":["No historical execution, global non-execution, or enforcement claim.","No remote policy collection is performed."],"rule_id":"CIT_REQUIRED_CHECKS_UNKNOWN","scope":{"kind":"REPOSITORY","subject":"snapshot-1ec9211d44ad3de6ba87a089201b2b54a03cac3500419fff0ada15ae45d573c4"}},{"certainty":"UNKNOWN","certainty_rule":"Bounded offline literal configuration analysis; no run or remote policy evidence.","evidence_refs":["evidence:77d5e9a3f37b99b3dbbba7c4ca5283734dfa318adc1bb4337f2c3672e74932c5"],"explanation":"Command/action internals are not a recognized literal validation path.","id":"finding:6c5cc6271a0e17e4c4b7d89613f6ed80cec4c14664ddb43465c61c3cc2d16bf4","limitations":["No historical execution, global non-execution, or enforcement claim.","Names, echo and unsupported wrappers establish no validation category."],"rule_id":"CIT_DYNAMIC_PATH","scope":{"kind":"STEP","subject":"step:6f20e3b530173b94f55a2cbd8a32682a682ac24d44d5cd787b0dfb4f7dd8e916"}}],"inventory":[{"evidence_refs":[],"id":"check:638bedb6e1e53eef2c4387a162664c6774c4922b74dd454f0d3609581e1a5fd3","kind":"CHECK","name":"Bounded offline validation configuration","source":{"column":1,"line":1,"path":".github/workflows/ci.yml"}}],"limitations":["Offline bounded configuration only. Historical execution, efficacy and required-check enforcement are UNKNOWN. Runner OS is not a cross-compilation target. Generic TEST intent is not unit, integration or E2E completeness."],"schema_version":"1","snapshot":{"commit_sha":null,"id":"snapshot-1ec9211d44ad3de6ba87a089201b2b54a03cac3500419fff0ada15ae45d573c4","repository_id":null},"workflows":[{"events":["push"],"id":"workflow:5d60c92b61b5a86654ab4d38782d62852528a098de97c477826007c94da09f2b","jobs":[{"evidence_refs":["evidence:4e633eb62db939e8d451d3cd398ad9440e2e21f7a002888e6086b02ab53fdec9"],"id":"job:786f8b6a9e3d63dc4314cbd0f883e13e9b4616465935f7fda7be9db8a84ff479","needs":[]}],"source":{"column":1,"line":1,"path":".github/workflows/ci.yml"}}]}
