{"capabilities":[{"check_id":"check:5af7215463cc58a6cd7bf354f230bb5414cefa6959ef1207623558442679975f","dimension":"CONFIGURATION","evidence_refs":["evidence:6fcf18be881fbaa912840275e3861632052e6c59515db6531886cc38338b1f31"],"id":"capability:1cd23ed4fa860aa3af8aea40c1652c4048ec96fc6e0a096f97bb85b8f6db507a","limitations":["Bounded generic intent only; no complete functional coverage or remote policy inference."],"scope":{"kind":"STEP","subject":"step:cf64dc38cf6f168e26635c4554122bfe39b746ef68b7f0bd38489d40fdfc1de3"},"status":"PRESENT"},{"check_id":"check:5af7215463cc58a6cd7bf354f230bb5414cefa6959ef1207623558442679975f","dimension":"EXECUTION","evidence_refs":["evidence:c75a5c59126e0bbaec3b7c2089d608f85306e767308025bb35bcbb78380b1783"],"id":"capability:aa32d3313c620fa49730891d087b9828b2d75012706f2380f65c9547a08d4ad5","limitations":["Bounded generic intent only; no complete functional coverage or remote policy inference."],"scope":{"kind":"REPOSITORY","subject":"snapshot-97a15c14b05a27bc62859d4c63361ac0828f7136dfcfb91ad935c85dd27829e9"},"status":"UNKNOWN"},{"check_id":"check:5af7215463cc58a6cd7bf354f230bb5414cefa6959ef1207623558442679975f","dimension":"ENFORCEMENT","evidence_refs":["evidence:c75a5c59126e0bbaec3b7c2089d608f85306e767308025bb35bcbb78380b1783"],"id":"capability:b096d8052da0e7375b6735388cfd4ef95f9d79ecf80c32f070525732058b3ede","limitations":["Bounded generic intent only; no complete functional coverage or remote policy inference."],"scope":{"kind":"REPOSITORY","subject":"snapshot-97a15c14b05a27bc62859d4c63361ac0828f7136dfcfb91ad935c85dd27829e9"},"status":"UNKNOWN"},{"check_id":"check:5af7215463cc58a6cd7bf354f230bb5414cefa6959ef1207623558442679975f","dimension":"EFFICACY","evidence_refs":["evidence:c75a5c59126e0bbaec3b7c2089d608f85306e767308025bb35bcbb78380b1783"],"id":"capability:d665cfb22f85b8e0ebc3c1546f1324ce1ef241aaa9c98c8eab1b1850a7a04aec","limitations":["Bounded generic intent only; no complete functional coverage or remote policy inference."],"scope":{"kind":"REPOSITORY","subject":"snapshot-97a15c14b05a27bc62859d4c63361ac0828f7136dfcfb91ad935c85dd27829e9"},"status":"UNKNOWN"}],"diagnostics":[{"code":"unresolved-matrix","id":"diagnostic:1c11d7cf5131e55e4abcc95e9cf72421ed380408f9a42cccf02e8ba413df67c0","message":"Static analysis could not resolve this input; no execution or enforcement is inferred.","source":{"column":15,"line":5,"path":".github/workflows/ci.yml"}},{"code":"unresolved-runner","id":"diagnostic:3af3a1ed18c48f495cb3e00e47cc05a8fd77c275e6d1f9a66de6dc2c4e4b7638","message":"Static analysis could not resolve this input; no execution or enforcement is inferred.","source":{"column":14,"line":6,"path":".github/workflows/ci.yml"}}],"evidence":[{"cause":null,"check_id":"check:5af7215463cc58a6cd7bf354f230bb5414cefa6959ef1207623558442679975f","execution":null,"id":"evidence:0ba56be7567f85a5e76e18b6497ebb1d705f2b1c35aec8ca05ba671d9b352dc5","limitations":["Static configuration only; historical execution and remote enforcement remain UNKNOWN."],"provenance":{"adapter":"audit-v1","basis":"SOURCE","kind":"CONFIGURATION","sources":[{"column":9,"line":8,"path":".github/workflows/ci.yml"},{"column":14,"line":8,"path":".github/workflows/ci.yml"}]},"scope":{"kind":"STEP","subject":"step:cf64dc38cf6f168e26635c4554122bfe39b746ef68b7f0bd38489d40fdfc1de3"},"state":"CONFIGURED"},{"cause":null,"check_id":"check:5af7215463cc58a6cd7bf354f230bb5414cefa6959ef1207623558442679975f","execution":null,"id":"evidence:188f11daf743c444f41e20220ae6eaff344d2d4f7faaa6c62d4957e8216ab04d","limitations":["Static configuration only; historical execution and remote enforcement remain UNKNOWN."],"provenance":{"adapter":"audit-v1","basis":"SOURCE","kind":"CONFIGURATION","sources":[{"column":2,"line":1,"path":".ci-trust.json"},{"column":14,"line":1,"path":".ci-trust.json"}]},"scope":{"kind":"REPOSITORY","subject":"snapshot-97a15c14b05a27bc62859d4c63361ac0828f7136dfcfb91ad935c85dd27829e9"},"state":"CONFIGURED"},{"cause":null,"check_id":"check:5af7215463cc58a6cd7bf354f230bb5414cefa6959ef1207623558442679975f","execution":null,"id":"evidence:6fcf18be881fbaa912840275e3861632052e6c59515db6531886cc38338b1f31","limitations":["Static configuration only; historical execution and remote enforcement remain UNKNOWN."],"provenance":{"adapter":"audit-v1","basis":"SOURCE","kind":"CONFIGURATION","sources":[{"column":9,"line":8,"path":".github/workflows/ci.yml"},{"column":14,"line":8,"path":".github/workflows/ci.yml"}]},"scope":{"kind":"STEP","subject":"step:cf64dc38cf6f168e26635c4554122bfe39b746ef68b7f0bd38489d40fdfc1de3"},"state":"CONFIGURED"},{"cause":null,"check_id":"check:5af7215463cc58a6cd7bf354f230bb5414cefa6959ef1207623558442679975f","execution":null,"id":"evidence:894113871acdfe06cc3fb925df97d9edda7a61a52546cd53a4ab62cf5f00eeb3","limitations":["Static configuration only; historical execution and remote enforcement remain UNKNOWN."],"provenance":{"adapter":"audit-v1","basis":"SOURCE","kind":"CONFIGURATION","sources":[{"column":3,"line":3,"path":".github/workflows/ci.yml"},{"column":14,"line":6,"path":".github/workflows/ci.yml"},{"column":15,"line":5,"path":".github/workflows/ci.yml"}]},"scope":{"kind":"JOB","subject":"job:6d5e32ac1d22ee321ff54124493143e7171272d6ea9a1c91792fea6f8f1b36ba"},"state":"CONFIGURED"},{"cause":null,"check_id":"check:5af7215463cc58a6cd7bf354f230bb5414cefa6959ef1207623558442679975f","execution":null,"id":"evidence:c75a5c59126e0bbaec3b7c2089d608f85306e767308025bb35bcbb78380b1783","limitations":["Static configuration only; historical execution and remote enforcement remain UNKNOWN."],"provenance":{"adapter":"audit-v1","basis":"UNRESOLVED","kind":"DIAGNOSTIC","sources":[]},"scope":{"kind":"REPOSITORY","subject":"snapshot-97a15c14b05a27bc62859d4c63361ac0828f7136dfcfb91ad935c85dd27829e9"},"state":"UNKNOWN"}],"findings":[{"certainty":"UNKNOWN","certainty_rule":"Bounded offline literal configuration analysis; no run or remote policy evidence.","evidence_refs":["evidence:c75a5c59126e0bbaec3b7c2089d608f85306e767308025bb35bcbb78380b1783"],"explanation":"Required checks and actual enforcement remain UNKNOWN offline.","id":"finding:3353e00d7fdc1ce2cca4ff585c4f8b407826914c6b0405adf1a0b3d649eabf8f","limitations":["No historical execution, global non-execution, or enforcement claim.","No remote policy collection is performed."],"rule_id":"CIT_REQUIRED_CHECKS_UNKNOWN","scope":{"kind":"REPOSITORY","subject":"snapshot-97a15c14b05a27bc62859d4c63361ac0828f7136dfcfb91ad935c85dd27829e9"}},{"certainty":"UNKNOWN","certainty_rule":"Bounded offline literal configuration analysis; no run or remote policy evidence.","evidence_refs":["evidence:894113871acdfe06cc3fb925df97d9edda7a61a52546cd53a4ab62cf5f00eeb3"],"explanation":"Runner or matrix path remains UNKNOWN.","id":"finding:85d6cae626beb6c1339fa87c770d7d52109b73628d23681f2d3af7b81eae6cb3","limitations":["No historical execution, global non-execution, or enforcement claim.","Dynamic runners and matrices cannot establish platform absence."],"rule_id":"CIT_DYNAMIC_PATH","scope":{"kind":"JOB","subject":"job:6d5e32ac1d22ee321ff54124493143e7171272d6ea9a1c91792fea6f8f1b36ba"}}],"inventory":[{"evidence_refs":[],"id":"check:5af7215463cc58a6cd7bf354f230bb5414cefa6959ef1207623558442679975f","kind":"CHECK","name":"Bounded offline validation configuration","source":{"column":1,"line":1,"path":".github/workflows/ci.yml"}}],"limitations":["Offline bounded configuration only. Historical execution, efficacy and required-check enforcement are UNKNOWN. Runner OS is not a cross-compilation target. Generic TEST intent is not unit, integration or E2E completeness.","Configured TEST intent only within a source-backed step; no inferred category completeness.","Platform absence cannot be established: reader omissions, unresolved commands, event filters, conditions, dependencies, runners or matrices leave the configured scope open."],"schema_version":"1","snapshot":{"commit_sha":null,"id":"snapshot-97a15c14b05a27bc62859d4c63361ac0828f7136dfcfb91ad935c85dd27829e9","repository_id":null},"workflows":[{"events":["push"],"id":"workflow:5d60c92b61b5a86654ab4d38782d62852528a098de97c477826007c94da09f2b","jobs":[{"evidence_refs":["evidence:894113871acdfe06cc3fb925df97d9edda7a61a52546cd53a4ab62cf5f00eeb3"],"id":"job:6d5e32ac1d22ee321ff54124493143e7171272d6ea9a1c91792fea6f8f1b36ba","needs":[]}],"source":{"column":1,"line":1,"path":".github/workflows/ci.yml"}}]}
