{"capabilities":[{"check_id":"check:bfcfd34a8f9ac0854553207ba91b3e24a89e9907d5ef677d323442b8e8af542f","dimension":"CONFIGURATION","evidence_refs":["evidence:24e832be271fe9a0f1b36b6f66a611778abc9696a81eb4cea5aad3beba969a36"],"id":"capability:963463a9dec34227b6d383613667d7b5714775d16203eb6c82181e5056b3dcf9","limitations":["Bounded generic intent only; no complete functional coverage or remote policy inference."],"scope":{"kind":"STEP","subject":"step:b24b53c93f0f4885502c5bed4407faf6cabc9513ec13e09555bddaeac7b9015c"},"status":"PRESENT"},{"check_id":"check:bfcfd34a8f9ac0854553207ba91b3e24a89e9907d5ef677d323442b8e8af542f","dimension":"EXECUTION","evidence_refs":["evidence:c75a5c59126e0bbaec3b7c2089d608f85306e767308025bb35bcbb78380b1783"],"id":"capability:aa32d3313c620fa49730891d087b9828b2d75012706f2380f65c9547a08d4ad5","limitations":["Bounded generic intent only; no complete functional coverage or remote policy inference."],"scope":{"kind":"REPOSITORY","subject":"snapshot-d2e33463b0d9a90386efa20f3ce7d271f931af4ff79a8a2d3fa45e07cbc796fd"},"status":"UNKNOWN"},{"check_id":"check:bfcfd34a8f9ac0854553207ba91b3e24a89e9907d5ef677d323442b8e8af542f","dimension":"ENFORCEMENT","evidence_refs":["evidence:c75a5c59126e0bbaec3b7c2089d608f85306e767308025bb35bcbb78380b1783"],"id":"capability:b096d8052da0e7375b6735388cfd4ef95f9d79ecf80c32f070525732058b3ede","limitations":["Bounded generic intent only; no complete functional coverage or remote policy inference."],"scope":{"kind":"REPOSITORY","subject":"snapshot-d2e33463b0d9a90386efa20f3ce7d271f931af4ff79a8a2d3fa45e07cbc796fd"},"status":"UNKNOWN"},{"check_id":"check:bfcfd34a8f9ac0854553207ba91b3e24a89e9907d5ef677d323442b8e8af542f","dimension":"EFFICACY","evidence_refs":["evidence:c75a5c59126e0bbaec3b7c2089d608f85306e767308025bb35bcbb78380b1783"],"id":"capability:d665cfb22f85b8e0ebc3c1546f1324ce1ef241aaa9c98c8eab1b1850a7a04aec","limitations":["Bounded generic intent only; no complete functional coverage or remote policy inference."],"scope":{"kind":"REPOSITORY","subject":"snapshot-d2e33463b0d9a90386efa20f3ce7d271f931af4ff79a8a2d3fa45e07cbc796fd"},"status":"UNKNOWN"}],"diagnostics":[],"evidence":[{"cause":null,"check_id":"check:bfcfd34a8f9ac0854553207ba91b3e24a89e9907d5ef677d323442b8e8af542f","execution":null,"id":"evidence:188f11daf743c444f41e20220ae6eaff344d2d4f7faaa6c62d4957e8216ab04d","limitations":["Static configuration only; historical execution and remote enforcement remain UNKNOWN."],"provenance":{"adapter":"audit-v1","basis":"SOURCE","kind":"CONFIGURATION","sources":[{"column":2,"line":1,"path":".ci-trust.json"},{"column":14,"line":1,"path":".ci-trust.json"}]},"scope":{"kind":"REPOSITORY","subject":"snapshot-d2e33463b0d9a90386efa20f3ce7d271f931af4ff79a8a2d3fa45e07cbc796fd"},"state":"CONFIGURED"},{"cause":null,"check_id":"check:bfcfd34a8f9ac0854553207ba91b3e24a89e9907d5ef677d323442b8e8af542f","execution":null,"id":"evidence:24e832be271fe9a0f1b36b6f66a611778abc9696a81eb4cea5aad3beba969a36","limitations":["Static configuration only; historical execution and remote enforcement remain UNKNOWN."],"provenance":{"adapter":"audit-v1","basis":"SOURCE","kind":"CONFIGURATION","sources":[{"column":9,"line":10,"path":".github/workflows/ci.yml"},{"column":14,"line":10,"path":".github/workflows/ci.yml"}]},"scope":{"kind":"STEP","subject":"step:b24b53c93f0f4885502c5bed4407faf6cabc9513ec13e09555bddaeac7b9015c"},"state":"CONFIGURED"},{"cause":null,"check_id":"check:bfcfd34a8f9ac0854553207ba91b3e24a89e9907d5ef677d323442b8e8af542f","execution":null,"id":"evidence:7c236be97fd7301fe36b050561172508b14a55deff3908395799d8370ec8c337","limitations":["Static configuration only; historical execution and remote enforcement remain UNKNOWN."],"provenance":{"adapter":"audit-v1","basis":"SOURCE","kind":"CONFIGURATION","sources":[{"column":3,"line":4,"path":".github/workflows/ci.yml"},{"column":14,"line":8,"path":".github/workflows/ci.yml"},{"column":9,"line":7,"path":".github/workflows/ci.yml"},{"column":14,"line":7,"path":".github/workflows/ci.yml"},{"column":29,"line":7,"path":".github/workflows/ci.yml"},{"column":45,"line":7,"path":".github/workflows/ci.yml"},{"column":14,"line":10,"path":".github/workflows/ci.yml"}]},"scope":{"kind":"REPOSITORY","subject":"snapshot-d2e33463b0d9a90386efa20f3ce7d271f931af4ff79a8a2d3fa45e07cbc796fd"},"state":"CONFIGURED"},{"cause":null,"check_id":"check:bfcfd34a8f9ac0854553207ba91b3e24a89e9907d5ef677d323442b8e8af542f","execution":null,"id":"evidence:894113871acdfe06cc3fb925df97d9edda7a61a52546cd53a4ab62cf5f00eeb3","limitations":["Static configuration only; historical execution and remote enforcement remain UNKNOWN."],"provenance":{"adapter":"audit-v1","basis":"SOURCE","kind":"CONFIGURATION","sources":[{"column":3,"line":4,"path":".github/workflows/ci.yml"},{"column":14,"line":8,"path":".github/workflows/ci.yml"},{"column":9,"line":7,"path":".github/workflows/ci.yml"}]},"scope":{"kind":"JOB","subject":"job:6d5e32ac1d22ee321ff54124493143e7171272d6ea9a1c91792fea6f8f1b36ba"},"state":"CONFIGURED"},{"cause":null,"check_id":"check:bfcfd34a8f9ac0854553207ba91b3e24a89e9907d5ef677d323442b8e8af542f","execution":null,"id":"evidence:9a1224fad6e335f3302f803c8411b55b6a0944395b5604d4b87919740909c1df","limitations":["Static configuration only; historical execution and remote enforcement remain UNKNOWN."],"provenance":{"adapter":"audit-v1","basis":"SOURCE","kind":"CONFIGURATION","sources":[{"column":9,"line":10,"path":".github/workflows/ci.yml"},{"column":14,"line":10,"path":".github/workflows/ci.yml"}]},"scope":{"kind":"STEP","subject":"step:b24b53c93f0f4885502c5bed4407faf6cabc9513ec13e09555bddaeac7b9015c"},"state":"CONFIGURED"},{"cause":null,"check_id":"check:bfcfd34a8f9ac0854553207ba91b3e24a89e9907d5ef677d323442b8e8af542f","execution":null,"id":"evidence:c75a5c59126e0bbaec3b7c2089d608f85306e767308025bb35bcbb78380b1783","limitations":["Static configuration only; historical execution and remote enforcement remain UNKNOWN."],"provenance":{"adapter":"audit-v1","basis":"UNRESOLVED","kind":"DIAGNOSTIC","sources":[]},"scope":{"kind":"REPOSITORY","subject":"snapshot-d2e33463b0d9a90386efa20f3ce7d271f931af4ff79a8a2d3fa45e07cbc796fd"},"state":"UNKNOWN"}],"findings":[{"certainty":"UNKNOWN","certainty_rule":"Bounded offline literal configuration analysis; no run or remote policy evidence.","evidence_refs":["evidence:c75a5c59126e0bbaec3b7c2089d608f85306e767308025bb35bcbb78380b1783"],"explanation":"Required checks and actual enforcement remain UNKNOWN offline.","id":"finding:3353e00d7fdc1ce2cca4ff585c4f8b407826914c6b0405adf1a0b3d649eabf8f","limitations":["No historical execution, global non-execution, or enforcement claim.","No remote policy collection is performed."],"rule_id":"CIT_REQUIRED_CHECKS_UNKNOWN","scope":{"kind":"REPOSITORY","subject":"snapshot-d2e33463b0d9a90386efa20f3ce7d271f931af4ff79a8a2d3fa45e07cbc796fd"}}],"inventory":[{"evidence_refs":[],"id":"check:bfcfd34a8f9ac0854553207ba91b3e24a89e9907d5ef677d323442b8e8af542f","kind":"CHECK","name":"Bounded offline validation configuration","source":{"column":1,"line":1,"path":".github/workflows/ci.yml"}}],"limitations":["Offline bounded configuration only. Historical execution, efficacy and required-check enforcement are UNKNOWN. Runner OS is not a cross-compilation target. Generic TEST intent is not unit, integration or E2E completeness.","Configured TEST intent only within a source-backed step; no inferred category completeness."],"schema_version":"1","snapshot":{"commit_sha":null,"id":"snapshot-d2e33463b0d9a90386efa20f3ce7d271f931af4ff79a8a2d3fa45e07cbc796fd","repository_id":null},"workflows":[{"events":["merge_group","pull_request","push"],"id":"workflow:5d60c92b61b5a86654ab4d38782d62852528a098de97c477826007c94da09f2b","jobs":[{"evidence_refs":["evidence:894113871acdfe06cc3fb925df97d9edda7a61a52546cd53a4ab62cf5f00eeb3"],"id":"job:6d5e32ac1d22ee321ff54124493143e7171272d6ea9a1c91792fea6f8f1b36ba","needs":[]}],"source":{"column":1,"line":1,"path":".github/workflows/ci.yml"}}]}
